{
  "schema_version": "market_pick.v1.1",
  "pick_id": "cards_2f4968d30077",
  "created_at": "2026-03-23T15:19:07Z",
  "module_id": "cards",
  "module_version": "cards.1.1.0-staging",
  "event_id": 910003,
  "match_label": "Gil Vicente vs Famalicão",
  "competition": "Primeira Liga",
  "kickoff_datetime": "2026-03-30T20:15:00Z",
  "market_family": "cards",
  "market": "away_team_cards_over",
  "selection": "over",
  "line": 2.5,
  "odds": 1.95,
  "eligibility": true,
  "score_raw": 90,
  "confidence_raw": 4,
  "risk_raw": 1,
  "edge_raw": "80.0%",
  "rationale_summary": "Sinal disciplinar construído a partir do provider central, com projeção, contexto competitivo e filtro de elegibilidade.",
  "main_drivers": [
    "match_cards_projection=4.5",
    "match_tension=medium",
    "competitive_pressure=high"
  ],
  "penalties": [
    "referee_unknown"
  ],
  "data_quality_flag": "partial",
  "module_rank_internal": 1,
  "expiry_context": "refresh_if_odds_move_or_referee_changes",
  "module_specific_payload": {
    "discipline_profile": "hot",
    "match_cards_projection": 4.5,
    "home_cards_projection": 2.0,
    "away_cards_projection": 2.6,
    "match_tension_flag": "medium",
    "competitive_pressure": "high",
    "referee_used": false,
    "referee_bias": "neutral",
    "referee_confidence": "low",
    "home_away_asymmetry": "away_more_cards_likely",
    "recent_intensity_signal": "positive_for_over",
    "structural_bias": "over",
    "signal_consistency": "medium_high",
    "sample_depth_flag": "medium",
    "provider_name": "central_cards_provider.v1",
    "provider_status": "candidate"
  }
}